{
  "schema_version": "2.0.0",
  "debate_id": "nvda_structured_debate_v2_extended",
  "run_id": "f17c9c8b-22b5-41df-93a1-76d6f1c6d221",
  "mode": "posthoc",
  "created_at": "2026-02-20T22:05:00Z",

  "run_metadata": {
    "generation_mode": "ablation",
    "global_model_name": "mixed",
    "temperature": 0.5,
    "top_p": 0.95,
    "seed": 123,
    "max_tokens": 2500,
    "prompt_bundle_version": "v3.2",
    "prompt_regime": "structured",
    "notes": "Extended 3-round debate for topology analysis."
  },

  "debate_metadata": {
    "task_type": "investment_debate",
    "scenario_id": "nvda_capex_sensitivity",
    "market_context": "Hyperscaler spending inflection risk",
    "topic": "Structural vs cyclical AI demand",
    "asset_symbol": "NVDA",
    "time_horizon_default": "6–18 months",
    "notes": "Testing multi-round interaction depth."
  },

  "participants": [
    {
      "agent_id": "NVDA_BEAR_GPT4o",
      "role": "bear",
      "model_name": "gpt-4o",
      "system_prompt_version": "bear_v2"
    },
    {
      "agent_id": "NVDA_BULL_Claude",
      "role": "bull",
      "model_name": "claude-3-opus",
      "system_prompt_version": "bull_v2"
    }
  ],

  "rounds": [
    {
      "round_index": 1,
      "turns": [
        {
          "turn_id": "r1_t1",
          "round_index": 1,
          "turn_index_in_round": 0,
          "speaker_id": "NVDA_BEAR_GPT4o",
          "turn_outcome": "success",
          "attempts": [
            {
              "attempt_index": 0,
              "timestamp": "2026-02-20T22:05:01Z",
              "status": "ok",
              "content": "### CLAIM\nCurrent valuation assumes uninterrupted acceleration.\n\n### DECISION\nSHORT NVDA | SIZE: 6% | HORIZON: 4–8 months\n\n### CORE RISK\nCapex moderation could trigger asymmetric multiple compression.",
              "final_answer": "SHORT NVDA",
              "recommendation_hint": {
                "action": "SHORT",
                "position_size_pct_min": 6,
                "position_size_pct_max": 6,
                "horizon_days_min": 120,
                "horizon_days_max": 240,
                "conviction": 0.7
              },
              "reasoning_trace": null,
              "control_state": null
            }
          ]
        }
      ]
    },

    {
      "round_index": 2,
      "turns": [
        {
          "turn_id": "r2_t1",
          "round_index": 2,
          "turn_index_in_round": 0,
          "speaker_id": "NVDA_BULL_Claude",
          "turn_outcome": "success",
          "attempts": [
            {
              "attempt_index": 0,
              "timestamp": "2026-02-20T22:06:02Z",
              "status": "ok",
              "content": "### RESPONSE TO BEAR\nYou assume demand moderation implies structural weakening.\n\n### CLAIM\nDemand is structural, not cyclical.\n\n### DECISION\nBUY NVDA | SIZE: 10% | HORIZON: 12–24 months\n\n### DEFENSE\nAI ROI validation embeds spending into enterprise budgets.",
              "final_answer": "BUY NVDA",
              "recommendation_hint": {
                "action": "BUY",
                "position_size_pct_min": 10,
                "position_size_pct_max": 10,
                "horizon_days_min": 365,
                "horizon_days_max": 720,
                "conviction": 0.82
              },
              "reasoning_trace": null,
              "control_state": null
            }
          ]
        }
      ]
    },

    {
      "round_index": 3,
      "turns": [
        {
          "turn_id": "r3_t1",
          "round_index": 3,
          "turn_index_in_round": 0,
          "speaker_id": "NVDA_BEAR_GPT4o",
          "turn_outcome": "success",
          "attempts": [
            {
              "attempt_index": 0,
              "timestamp": "2026-02-20T22:07:15Z",
              "status": "ok",
              "content": "### REBUTTAL\nStructural thesis depends on uninterrupted hyperscaler expansion.\n\n### UPDATED CLAIM\nRisk/reward remains skewed to short-term downside.\n\n### FINAL POSITION\nMaintain SHORT 6% allocation.\n\n### CONSISTENCY CHECK\nNo stance shift.",
              "final_answer": "Maintain SHORT",
              "recommendation_hint": {
                "action": "SHORT",
                "position_size_pct_min": 6,
                "position_size_pct_max": 6,
                "horizon_days_min": 120,
                "horizon_days_max": 240,
                "conviction": 0.68
              },
              "reasoning_trace": null,
              "control_state": null
            }
          ]
        }
      ]
    }
  ]
}